{
  "schema_id": "pytex.benchmark_manifest",
  "schema_version": "1.0.0",
  "pytex_version": "0.1.0.dev0",
  "created_at": "2026-03-26T00:00:00Z",
  "benchmark_id": "diffraction_foundation_internal_baseline",
  "subsystem": "diffraction",
  "baseline_kind": "internal_invariants",
  "workflows": [
    "geometry_invariants",
    "kinematic_spot_simulation",
    "reflection_family_grouping",
    "orientation_candidate_ranking",
    "measured_powder_profile_comparison"
  ],
  "fixture_ids": [
    "fe_bcc",
    "zr_hcp",
    "ni_fcc",
    "nicl",
    "diamond",
    "fixtures/diffraction/synthetic_powder_profile.xy"
  ],
  "artifact_paths": [
    "benchmarks/diffraction/foundation_benchmark_manifest.json",
    "fixtures/phases/catalog.json",
    "fixtures/phases/fe_bcc/phase.cif",
    "fixtures/phases/zr_hcp/phase.cif",
    "fixtures/phases/ni_fcc/phase.cif",
    "fixtures/phases/nicl/phase.cif",
    "fixtures/phases/diamond/phase.cif",
    "fixtures/diffraction/synthetic_powder_profile.xy"
  ],
  "tolerances": {
    "projection_atol": 1e-08,
    "bragg_argument_atol": 1e-12,
    "powder_affine_fit_atol": 1e-12
  },
  "status": "foundational",
  "notes": [
    "Benchmark harness is still lightweight, but the schema and benchmark identity are now stable.",
    "This manifest anchors the current diffraction foundation benchmark surface.",
    "The bundled phase corpus under fixtures/phases provides small pinned diffraction inputs for easy local validation.",
    "The measured-profile case is explicitly labelled synthetic; its exact affine scale/background solution is independent of PyTex output."
  ]
}
