{
  "schema_id": "pytex.benchmark_manifest",
  "schema_version": "1.0.0",
  "pytex_version": "0.1.0.dev0",
  "created_at": "2026-03-26T00:00:00Z",
  "benchmark_id": "ebsd_foundation_internal_baseline",
  "subsystem": "ebsd",
  "baseline_kind": "mtex_plus_internal",
  "workflows": [
    "kernel_average_misorientation",
    "hexagonal_neighbor_graph",
    "grain_segmentation",
    "grod",
    "boundary_extraction",
    "cleanup"
  ],
  "fixture_ids": [
    "fixtures/mtex_parity/ebsd/kam_cases.json",
    "fixtures/ebsd/synthetic_hex_grid.ang"
  ],
  "artifact_paths": [
    "benchmarks/ebsd/foundation_benchmark_manifest.json"
  ],
  "tolerances": {
    "misorientation_atol_deg": 1e-06
  },
  "status": "implemented",
  "notes": [
    "This benchmark manifest anchors rectangular, coordinate-graph, and staggered-hexagonal EBSD workflows.",
    "The 3/2/3-row .ang fixture is analytically constructed and explicitly not experimental; it pins 13 first-shell edges and a direct KAM vector."
  ]
}
