{
  "schema_id": "pytex.benchmark_manifest",
  "schema_version": "1.0.0",
  "pytex_version": "0.1.0.dev0",
  "created_at": "2026-03-29T00:00:00Z",
  "benchmark_id": "plotting_visual_regression_suite",
  "subsystem": "plotting",
  "baseline_kind": "deterministic_svg_regression",
  "workflows": [
    "xrd_publication_style_regression",
    "saed_publication_style_regression",
    "crystal_scene_publication_style_regression",
    "ipf_runtime_style_regression"
  ],
  "fixture_ids": [
    "ni_fcc",
    "zr_hcp"
  ],
  "artifact_paths": [
    "benchmarks/plotting/visual_regression_benchmark_manifest.json",
    "fixtures/visual_regression/README.md",
    "fixtures/visual_regression/xrd_ni_fcc_journal.svg",
    "fixtures/visual_regression/saed_ni_fcc_dark.svg",
    "fixtures/visual_regression/crystal_zr_hcp_journal.svg",
    "fixtures/visual_regression/ipf_ni_fcc_journal.svg",
    "scripts/generate_visual_regression_artifacts.py"
  ],
  "tolerances": {
    "svg_byte_regression_atol": 0.0
  },
  "status": "implemented",
  "notes": [
    "This benchmark records deterministic SVG regression artifacts for the highest-value publication-facing runtime plot families.",
    "The artifacts are generated with a fixed SVG hash salt and metadata date so label, overlay, and style drift become ordinary test failures."
  ]
}
